department,number,ddd,title,credits,description,prereq1,prereq2
CSI,696,CSI,Independent Teaching and Learning (1-3),1,"Participants extend and apply their understanding of computer science by tutoring or assisting in laboratory, tutoring or discussion activities, under faculty supervision, for one or more associated courses. One weekly contact hour and grading are required for each credit (or an equivalent obligation as determined by the faculty supervisor). Students must complete at least one relevant ITAL/ FTR training workshop during the semester in which they are enrolled in ICSI 696. May be repeated for credit with permission of the department. ",,
CSI,697,CSI,Independent Study and Research (1-3),1,Independent study and research in a particular area of computer science specialization under supervision of a departmental faculty member. May be repeated for credit with permission of the department. ,,
CSI,698,CSI,Internship (3),3,"Directed application of a particular area of computer science specialization via public or private sector employment.  Must be under supervision of a departmental faculty member.  The internship must demonstrate the ability to put science and/or managerial preparation to work in business, industry, or government.  May not be repeated for credit.  Qualifies for CPT for one semester only.  ",,
CSI,699,CSI,Master's Thesis (3-6),3,Original independent research at the master's level under direction of a member of computer science faculty. ,,
CSI,890,CSI,Independent Study and Research (3-19),3,Independent study at the doctoral level under the direction of a member of the computer science faculty. May be repeated for credit. ,,
CSI,899,CSI,Doctoral Research (1),1,Required of all candidates completing the degree of Doctor of Philosophy. Registration for this course is limited to doctoral students who have been admitted to candidacy. Course grading is Load Only and does not earn credit.,,
